{
  "catalog_api_version": "io.tobkiri.executable-catalog.v4",
  "catalog_digest": "sha256:696c1a3515344932a17463ec5f6119a85462e6807b52d15a1e9970fb17cec728",
  "pack_id": "rumi_ai_usage_pack",
  "source_identity": "sha256:e9d186ec3c1c0e99fa368d248a8160bb2f76f618c03e0a2069459c8e8aaad3c5",
  "variants": [
    {
      "architecture": "any",
      "backend": "tobkiri.python-host-v4",
      "execution_domain_profile": "host.extension.default.v1",
      "execution_kind": "host_extension",
      "function_id": "rumi_ai_usage_pack.ai-usage.cost",
      "implementation_digest": "sha256:16b80027e2859cff8515525ee87e16e4c33a6c222d54168d1f5fa9a145195316",
      "implementation_path": "runtime/usage.py",
      "materialization_mode": "on_demand",
      "operations": [
        {
          "contract_id": "tobkiri.service.ai.usage.cost.v1",
          "contract_version": "1.0.0",
          "effect_class": "privileged",
          "error_schema": {
            "type": "object"
          },
          "idempotency": "none",
          "input_schema": {
            "type": "object"
          },
          "operation_id": "rumi_ai_usage_pack.ai-usage-cost",
          "output_schema": {
            "type": "object"
          },
          "revision_digest": "sha256:04a8f126370dafe88c38fe8b465b97e666097e515823d55921d98f0c588d68fc",
          "timeout_default_ms": 30000,
          "timeout_hard_max_ms": 300000
        },
        {
          "contract_id": "tobkiri.service.ai.usage.cost.v1",
          "contract_version": "1.0.0",
          "effect_class": "privileged",
          "error_schema": {
            "type": "object"
          },
          "idempotency": "none",
          "input_schema": {
            "type": "object"
          },
          "operation_id": "rumi_ai_usage_pack.ai-usage-cost.generate",
          "output_schema": {
            "type": "object"
          },
          "revision_digest": "sha256:04a8f126370dafe88c38fe8b465b97e666097e515823d55921d98f0c588d68fc",
          "timeout_default_ms": 30000,
          "timeout_hard_max_ms": 300000
        },
        {
          "contract_id": "tobkiri.service.ai.usage.cost.v1",
          "contract_version": "1.0.0",
          "effect_class": "privileged",
          "error_schema": {
            "type": "object"
          },
          "idempotency": "none",
          "input_schema": {
            "type": "object"
          },
          "operation_id": "rumi_ai_usage_pack.ai-usage-cost.stream",
          "output_schema": {
            "type": "object"
          },
          "revision_digest": "sha256:04a8f126370dafe88c38fe8b465b97e666097e515823d55921d98f0c588d68fc",
          "timeout_default_ms": 30000,
          "timeout_hard_max_ms": 300000
        }
      ],
      "platform": "any",
      "runtime_abi": "python3.13",
      "variant_id": "rumi_ai_usage_pack.ai-usage.cost.python"
    },
    {
      "architecture": "any",
      "backend": "tobkiri.python-host-v4",
      "execution_domain_profile": "host.extension.default.v1",
      "execution_kind": "host_extension",
      "function_id": "rumi_ai_usage_pack.ai-usage.tokenize",
      "implementation_digest": "sha256:16b80027e2859cff8515525ee87e16e4c33a6c222d54168d1f5fa9a145195316",
      "implementation_path": "runtime/usage.py",
      "materialization_mode": "on_demand",
      "operations": [
        {
          "contract_id": "tobkiri.service.ai.tokenize.v1",
          "contract_version": "1.0.0",
          "effect_class": "privileged",
          "error_schema": {
            "type": "object"
          },
          "idempotency": "none",
          "input_schema": {
            "type": "object"
          },
          "operation_id": "rumi_ai_usage_pack.ai-tokenize",
          "output_schema": {
            "type": "object"
          },
          "revision_digest": "sha256:1b29b0e7a0b47690bf1dcc5656dd5cb968efcac2e35ef7713f5411fa45a7cdfd",
          "timeout_default_ms": 30000,
          "timeout_hard_max_ms": 300000
        }
      ],
      "platform": "any",
      "runtime_abi": "python3.13",
      "variant_id": "rumi_ai_usage_pack.ai-usage.tokenize.python"
    }
  ]
}
