{
  "catalog_api_version": "io.tobkiri.executable-catalog.v4",
  "catalog_digest": "sha256:2f067747904288771c01ddd21e2d18e5d76fa29fa4a15ef07865f8b7ea91ae4e",
  "pack_id": "rumi_scheduler_tool_adapter_pack",
  "source_identity": "sha256:1c889953e338d40e0bf0fee977807c2ce5b643a21e338f517f46cb43d9e38b21",
  "variants": [
    {
      "architecture": "any",
      "backend": "tobkiri.python-pack-v4",
      "execution_domain_profile": "sandbox.default.v1",
      "execution_kind": "pack_vm",
      "function_id": "rumi_scheduler_tool_adapter_pack.tool-adapter.scheduler",
      "implementation_digest": "sha256:8ed554a43f3d0507df77a9c76e3504d5358a3bb2a83361f8e199645d67e9a39c",
      "implementation_path": "runtime/adapter.py",
      "materialization_mode": "on_demand",
      "operations": [
        {
          "contract_id": "tobkiri.service.tool.local.operation.v1",
          "contract_version": "1.0.0",
          "effect_class": "read",
          "error_schema": {
            "type": "object"
          },
          "idempotency": "none",
          "input_schema": {
            "type": "object"
          },
          "operation_id": "rumi_scheduler_tool_adapter_pack.scheduler-tool-operation",
          "output_schema": {
            "type": "object"
          },
          "revision_digest": "sha256:d753fb22387c558033f78166130ea196ba979072a220af7a2ab25da279531e7e",
          "timeout_default_ms": 30000,
          "timeout_hard_max_ms": 300000
        }
      ],
      "platform": "any",
      "runtime_abi": "python3.13",
      "variant_id": "rumi_scheduler_tool_adapter_pack.tool-adapter.scheduler.python"
    },
    {
      "architecture": "any",
      "backend": "tobkiri.wasmtime-pulley-v1",
      "execution_domain_profile": "wasm.component.default.v1",
      "execution_kind": "wasm",
      "function_id": "rumi_scheduler_tool_adapter_pack.tool-definitions.scheduler",
      "implementation_digest": "sha256:4cfe0377e8aaaaa7f7530f729e31fe54f959904d3eb373cdb7630faf8895e611",
      "implementation_path": "runtime/definitions_component.wasm",
      "materialization_mode": "on_demand",
      "operations": [
        {
          "contract_id": "tobkiri.resource.tool.definition.contribution.v1",
          "contract_version": "1.0.0",
          "effect_class": "read",
          "error_schema": {
            "type": "object"
          },
          "idempotency": "none",
          "input_schema": {
            "type": "object"
          },
          "operation_id": "rumi_scheduler_tool_adapter_pack.scheduler-tool-definitions",
          "output_schema": {
            "type": "object"
          },
          "revision_digest": "sha256:a32b5e69496d1488bb466105b0836d9f2e30adf57b0ef821de625d392220e395",
          "timeout_default_ms": 30000,
          "timeout_hard_max_ms": 300000
        }
      ],
      "platform": "any",
      "runtime_abi": "component-v1",
      "variant_id": "rumi_scheduler_tool_adapter_pack.tool-definitions.scheduler.wasm"
    }
  ]
}
