{
  "catalog_api_version": "io.tobkiri.executable-catalog.v4",
  "catalog_digest": "sha256:e1ea0a9c6c112ff7b1e8c13522967932dc3748231266c4f872d69a7d0dda4f73",
  "pack_id": "rumi_connector_inbound_broker_pack",
  "source_identity": "sha256:8576606a39b3e9c691c4f0d5da80bbbfb59085f6fa1bcfd165c2f31af7dca04f",
  "variants": [
    {
      "architecture": "any",
      "backend": "tobkiri.python-pack-v4",
      "execution_domain_profile": "sandbox.default.v1",
      "execution_kind": "pack_vm",
      "function_id": "rumi_connector_inbound_broker_pack.connector-inbound.receive",
      "implementation_digest": "sha256:9d31421989dd635b488c4353bf7f50e24c878ded45daa8368c80af9e1361dd4f",
      "implementation_path": "runtime/broker.py",
      "materialization_mode": "on_demand",
      "operations": [
        {
          "contract_id": "tobkiri.transport.connector.inbound.v1",
          "contract_version": "1.0.0",
          "effect_class": "read",
          "error_schema": {
            "type": "object"
          },
          "idempotency": "none",
          "input_schema": {
            "type": "object"
          },
          "operation_id": "rumi_connector_inbound_broker_pack.connector-inbound",
          "output_schema": {
            "type": "object"
          },
          "revision_digest": "sha256:748cd63a8b4b645683cf600b5c80e53fc6df8041acd74738d268075b8f935bad",
          "timeout_default_ms": 30000,
          "timeout_hard_max_ms": 300000
        }
      ],
      "platform": "any",
      "runtime_abi": "python3.13",
      "variant_id": "rumi_connector_inbound_broker_pack.connector-inbound.receive.python"
    }
  ]
}
