{
  "catalog_api_version": "io.tobkiri.executable-catalog.v4",
  "catalog_digest": "sha256:30e3a35b95a7496918c5702ccedcfa197b42badccf49d184be6dc7e49aac75d0",
  "pack_id": "rumi_security_review_pack",
  "source_identity": "sha256:dd57377b8b7869e98a772c47f4a8ef598b5b20a99d260bb0806a0a8db5839173",
  "variants": []
}
