{
  "catalog_api_version": "io.tobkiri.executable-catalog.v4",
  "catalog_digest": "sha256:7232f06b46fa67d8dd4c75eb93325a7701ac083edec7fe4563a95d16c4bb6bbf",
  "pack_id": "rumi_terminal_session_pack",
  "source_identity": "sha256:fc5d8a706c178869e1093e1423415b3d160b7bfb44bc7458ad1a886985b55f96",
  "variants": [
    {
      "architecture": "any",
      "backend": "tobkiri.python-host-v4",
      "execution_domain_profile": "host.extension.default.v1",
      "execution_kind": "host_extension",
      "function_id": "rumi_terminal_session_pack.terminal-session.control",
      "implementation_digest": "sha256:4363d9f58c34afaf7a3ca8117f81f2fc986ea9c80f71d6429454118d2c35269f",
      "implementation_path": "runtime/sessions.py",
      "materialization_mode": "on_demand",
      "operations": [
        {
          "contract_id": "tobkiri.action.terminal.session.v1",
          "contract_version": "1.0.0",
          "effect_class": "privileged",
          "error_schema": {
            "type": "object"
          },
          "idempotency": "none",
          "input_schema": {
            "type": "object"
          },
          "operation_id": "rumi_terminal_session_pack.terminal-control",
          "output_schema": {
            "type": "object"
          },
          "revision_digest": "sha256:d9ccda2eeb820ca2069762e94f5a04ec1d655720b82264a084822069aeae74f7",
          "timeout_default_ms": 30000,
          "timeout_hard_max_ms": 300000
        }
      ],
      "platform": "any",
      "runtime_abi": "python3.13",
      "variant_id": "rumi_terminal_session_pack.terminal-session.control.python"
    },
    {
      "architecture": "any",
      "backend": "tobkiri.python-host-v4",
      "execution_domain_profile": "host.extension.default.v1",
      "execution_kind": "host_extension",
      "function_id": "rumi_terminal_session_pack.terminal-session.observe",
      "implementation_digest": "sha256:4363d9f58c34afaf7a3ca8117f81f2fc986ea9c80f71d6429454118d2c35269f",
      "implementation_path": "runtime/sessions.py",
      "materialization_mode": "on_demand",
      "operations": [
        {
          "contract_id": "tobkiri.resource.terminal.session.v1",
          "contract_version": "1.0.0",
          "effect_class": "privileged",
          "error_schema": {
            "type": "object"
          },
          "idempotency": "none",
          "input_schema": {
            "type": "object"
          },
          "operation_id": "rumi_terminal_session_pack.terminal-observe",
          "output_schema": {
            "type": "object"
          },
          "revision_digest": "sha256:77f4d6869b0b7f1f228e21973c8aecb2bc03a34ab72d8394a74c5ffebeaaad12",
          "timeout_default_ms": 30000,
          "timeout_hard_max_ms": 300000
        }
      ],
      "platform": "any",
      "runtime_abi": "python3.13",
      "variant_id": "rumi_terminal_session_pack.terminal-session.observe.python"
    }
  ]
}
