{
  "catalog_api_version": "io.tobkiri.executable-catalog.v4",
  "catalog_digest": "sha256:3456f27fa8b9606819b3303f082b43d39de73050816b6d5d79d20a74ca6e0e40",
  "pack_id": "rumi_connector_outbound_broker_pack",
  "source_identity": "sha256:93807f1a61d02cbc97aa2548e390207ad5b5def201a53ed240ca55ba855d38fd",
  "variants": [
    {
      "architecture": "any",
      "backend": "tobkiri.python-pack-v4",
      "execution_domain_profile": "sandbox.default.v1",
      "execution_kind": "pack_vm",
      "function_id": "rumi_connector_outbound_broker_pack.connector-outbound.control",
      "implementation_digest": "sha256:f5d20e862418385b9aedf06cb2e58fc3cd4a824022971061add8738c48747573",
      "implementation_path": "runtime/broker.py",
      "materialization_mode": "on_demand",
      "operations": [
        {
          "contract_id": "tobkiri.action.connector.outbound.v1",
          "contract_version": "1.0.0",
          "effect_class": "read",
          "error_schema": {
            "type": "object"
          },
          "idempotency": "none",
          "input_schema": {
            "type": "object"
          },
          "operation_id": "rumi_connector_outbound_broker_pack.connector-outbound-action",
          "output_schema": {
            "type": "object"
          },
          "revision_digest": "sha256:0eead236b012484d3a45388365189051ba4c941935a6d0c50700339977036d29",
          "timeout_default_ms": 30000,
          "timeout_hard_max_ms": 300000
        }
      ],
      "platform": "any",
      "runtime_abi": "python3.13",
      "variant_id": "rumi_connector_outbound_broker_pack.connector-outbound.control.python"
    },
    {
      "architecture": "any",
      "backend": "tobkiri.python-pack-v4",
      "execution_domain_profile": "sandbox.default.v1",
      "execution_kind": "pack_vm",
      "function_id": "rumi_connector_outbound_broker_pack.connector-outbound.status",
      "implementation_digest": "sha256:f5d20e862418385b9aedf06cb2e58fc3cd4a824022971061add8738c48747573",
      "implementation_path": "runtime/broker.py",
      "materialization_mode": "on_demand",
      "operations": [
        {
          "contract_id": "tobkiri.resource.connector.outbound.v1",
          "contract_version": "1.0.0",
          "effect_class": "read",
          "error_schema": {
            "type": "object"
          },
          "idempotency": "none",
          "input_schema": {
            "type": "object"
          },
          "operation_id": "rumi_connector_outbound_broker_pack.connector-outbound-resource",
          "output_schema": {
            "type": "object"
          },
          "revision_digest": "sha256:ec55fb71c9dc978eacca110070e3238872825622c4cb62f26a84e83d947096c4",
          "timeout_default_ms": 30000,
          "timeout_hard_max_ms": 300000
        }
      ],
      "platform": "any",
      "runtime_abi": "python3.13",
      "variant_id": "rumi_connector_outbound_broker_pack.connector-outbound.status.python"
    }
  ]
}
