{
  "catalog_api_version": "io.tobkiri.executable-catalog.v4",
  "catalog_digest": "sha256:d1613a4be5892956bb54a5c435fc7ba2e30d9c8af0da1977d6d341b75e49e147",
  "pack_id": "rumi_runtime_benchmark_pack",
  "source_identity": "sha256:39691e57efff84247334a4b307980f81a6c16852f684ff9c1228121e94dba02f",
  "variants": []
}
