{
  "catalog_api_version": "io.tobkiri.executable-catalog.v4",
  "catalog_digest": "sha256:19e898186cc252765d9075615016bd2a1ebdf0909054742abba28775ccd97402",
  "pack_id": "rumi_default_tool_projection_pack",
  "source_identity": "sha256:f81ec1645cccf0b4aa1ec1de5e9ceab964a11805a145ff3d3c0ddc26d22234e9",
  "variants": [
    {
      "architecture": "any",
      "backend": "tobkiri.python-host-v4",
      "execution_domain_profile": "host.extension.default.v1",
      "execution_kind": "host_extension",
      "function_id": "rumi_default_tool_projection_pack.default-tools.migration-source",
      "implementation_digest": "sha256:096c81bee83274703d22b6fbcfdd747b35d0fa7afe2c8745d19f814745d62e6d",
      "implementation_path": "runtime/projection.py",
      "materialization_mode": "on_demand",
      "operations": [
        {
          "contract_id": "tobkiri.resource.tool.migration.source.v1",
          "contract_version": "1.0.0",
          "effect_class": "privileged",
          "error_schema": {
            "type": "object"
          },
          "idempotency": "none",
          "input_schema": {
            "type": "object"
          },
          "operation_id": "rumi_default_tool_projection_pack.default-tool-migration-source",
          "output_schema": {
            "type": "object"
          },
          "revision_digest": "sha256:db31a74f3dad5d37fb4edefd83f3f24879ab52713bebdebcbd8e992463d6bd09",
          "timeout_default_ms": 30000,
          "timeout_hard_max_ms": 300000
        }
      ],
      "platform": "any",
      "runtime_abi": "python3.13",
      "variant_id": "rumi_default_tool_projection_pack.default-tools.migration-source.python"
    },
    {
      "architecture": "any",
      "backend": "tobkiri.python-host-v4",
      "execution_domain_profile": "host.extension.default.v1",
      "execution_kind": "host_extension",
      "function_id": "rumi_default_tool_projection_pack.tool-adapter.defaultspack-compat",
      "implementation_digest": "sha256:096c81bee83274703d22b6fbcfdd747b35d0fa7afe2c8745d19f814745d62e6d",
      "implementation_path": "runtime/projection.py",
      "materialization_mode": "on_demand",
      "operations": [
        {
          "contract_id": "tobkiri.service.tool.local.operation.v1",
          "contract_version": "1.0.0",
          "effect_class": "privileged",
          "error_schema": {
            "type": "object"
          },
          "idempotency": "none",
          "input_schema": {
            "type": "object"
          },
          "operation_id": "rumi_default_tool_projection_pack.default-tool-local-operation",
          "output_schema": {
            "type": "object"
          },
          "revision_digest": "sha256:a77395c8442f7ae695ac3b57016da5fdf1885624155168490981e7c9a2d363a5",
          "timeout_default_ms": 30000,
          "timeout_hard_max_ms": 300000
        }
      ],
      "platform": "any",
      "runtime_abi": "python3.13",
      "variant_id": "rumi_default_tool_projection_pack.tool-adapter.defaultspack-compat.python"
    }
  ]
}
