{
  "catalog_api_version": "io.tobkiri.executable-catalog.v4",
  "catalog_digest": "sha256:7caa3fd16a3cc10bd6df7ba14f893b6c80b7211ed200856634cf37806a19edbe",
  "pack_id": "rumi_deepthink_pack",
  "source_identity": "sha256:1fbc6d186115a1c7fe2bc381ff3adc649f6a31a1f6930b62cbc5e27dd61b1762",
  "variants": [
    {
      "architecture": "any",
      "backend": "tobkiri.python-pack-v4",
      "execution_domain_profile": "sandbox.default.v1",
      "execution_kind": "pack_vm",
      "function_id": "rumi_deepthink_pack.deepthink.execute",
      "implementation_digest": "sha256:acd2b6a612ce7f381fa218491b49bb5e2cdd83fa37e1109829dfbd95b2f4da61",
      "implementation_path": "runtime/strategy.py",
      "materialization_mode": "on_demand",
      "operations": [
        {
          "contract_id": "tobkiri.service.ai.strategy.execute.v1",
          "contract_version": "1.0.0",
          "effect_class": "read",
          "error_schema": {
            "additionalProperties": false,
            "properties": {
              "code": {
                "maxLength": 128,
                "minLength": 1,
                "type": "string"
              },
              "message": {
                "maxLength": 2048,
                "minLength": 1,
                "type": "string"
              }
            },
            "required": [
              "code",
              "message"
            ],
            "type": "object"
          },
          "idempotency": "none",
          "input_schema": {
            "$defs": {
              "identifier": {
                "maxLength": 256,
                "minLength": 1,
                "pattern": "^[^\\u0000-\\u001F\\u007F\\s](?:[^\\u0000-\\u001F\\u007F]{0,254}[^\\u0000-\\u001F\\u007F\\s])?$",
                "type": "string"
              }
            },
            "additionalProperties": false,
            "anyOf": [
              {
                "required": [
                  "model_profile_id"
                ]
              },
              {
                "required": [
                  "model_reference"
                ]
              }
            ],
            "properties": {
              "allow_failover": {
                "type": "boolean"
              },
              "deadline": {
                "minimum": 1,
                "type": "integer"
              },
              "idempotency_key": {
                "$ref": "#/$defs/identifier"
              },
              "input": {
                "maxLength": 16384,
                "type": "string"
              },
              "maximum_cost_microusd": {
                "maximum": 1000000,
                "minimum": 1,
                "type": "integer"
              },
              "messages": {
                "items": {
                  "type": "object"
                },
                "maxItems": 2048,
                "minItems": 1,
                "type": "array"
              },
              "model_profile_id": {
                "$ref": "#/$defs/identifier"
              },
              "model_reference": {
                "oneOf": [
                  {
                    "$ref": "#/$defs/identifier"
                  },
                  {
                    "additionalProperties": false,
                    "properties": {
                      "profile_id": {
                        "$ref": "#/$defs/identifier"
                      }
                    },
                    "required": [
                      "profile_id"
                    ],
                    "type": "object"
                  }
                ]
              },
              "parameters": {
                "type": "object"
              },
              "policy_revision": {
                "$ref": "#/$defs/identifier"
              },
              "profile_id": {
                "$ref": "#/$defs/identifier"
              },
              "request_id": {
                "$ref": "#/$defs/identifier"
              },
              "requirements": {
                "type": "object"
              },
              "system_prompt_digest": {
                "pattern": "^sha256:[0-9a-f]{64}$",
                "type": "string"
              },
              "tools": {
                "items": {
                  "type": "object"
                },
                "maxItems": 128,
                "type": "array"
              }
            },
            "required": [
              "request_id",
              "messages",
              "deadline",
              "idempotency_key"
            ],
            "type": "object"
          },
          "operation_id": "rumi_deepthink_pack.deepthink.execute",
          "output_schema": {
            "additionalProperties": true,
            "properties": {
              "catalog_provider_instance_id": {
                "type": "string"
              },
              "catalog_revision": {
                "type": "string"
              },
              "finish_reason": {
                "type": "string"
              },
              "model_id": {
                "type": "string"
              },
              "output": {},
              "pricing_revision": {
                "type": "string"
              },
              "provider_instance_id": {
                "type": "string"
              },
              "request_id": {
                "type": "string"
              },
              "status": {
                "const": "ok"
              },
              "strategy_runtime": {
                "additionalProperties": false,
                "properties": {
                  "approved": {
                    "type": "boolean"
                  },
                  "calls": {
                    "maximum": 5,
                    "minimum": 1,
                    "type": "integer"
                  },
                  "maximum_calls": {
                    "const": 5
                  },
                  "maximum_cost_microusd": {
                    "maximum": 1000000,
                    "minimum": 1,
                    "type": "integer"
                  },
                  "phases": {
                    "maxItems": 5,
                    "minItems": 1,
                    "type": "array"
                  },
                  "provider": {
                    "const": "rumi_deepthink_pack"
                  },
                  "reserved_cost_usd": {
                    "pattern": "^(?:0|[1-9][0-9]*)(?:\\.[0-9]+)?$",
                    "type": "string"
                  },
                  "tool_deferred": {
                    "type": "boolean"
                  },
                  "used_cost_usd": {
                    "pattern": "^(?:0|[1-9][0-9]*)(?:\\.[0-9]+)?$",
                    "type": [
                      "string",
                      "null"
                    ]
                  },
                  "version": {
                    "const": "1"
                  }
                },
                "required": [
                  "version",
                  "provider",
                  "approved",
                  "tool_deferred",
                  "calls",
                  "maximum_calls",
                  "maximum_cost_microusd",
                  "reserved_cost_usd",
                  "used_cost_usd",
                  "phases"
                ],
                "type": "object"
              },
              "tool_intents": {
                "type": "array"
              },
              "usage": {
                "type": "object"
              },
              "usage_cost": {
                "type": "object"
              }
            },
            "required": [
              "status",
              "request_id",
              "model_id",
              "provider_instance_id",
              "output",
              "tool_intents",
              "usage",
              "usage_cost",
              "strategy_runtime"
            ],
            "type": "object"
          },
          "revision_digest": "sha256:e1ef41b40fbecfb0e906995c37545b94b0c70ac46d95031b666804f03ba2f761",
          "timeout_default_ms": 30000,
          "timeout_hard_max_ms": 300000
        }
      ],
      "platform": "any",
      "runtime_abi": "python3.13",
      "variant_id": "rumi_deepthink_pack.deepthink.execute.python"
    }
  ]
}
