{
  "catalog_api_version": "io.tobkiri.executable-catalog.v4",
  "catalog_digest": "sha256:8fcbb242beb1af0b51a5f01dce56ee9b1f69566eafba375f2ec5600f97bdd80f",
  "pack_id": "rumi_operations_company_pack",
  "source_identity": "sha256:06c0aa3f8f3057db86cb49c108325652e042ca4e14f1a7700261344d7226d4a4",
  "variants": []
}
