{
  "catalog_api_version": "io.tobkiri.executable-catalog.v4",
  "catalog_digest": "sha256:aec9830cc0bfef2c30844d5ca1acca8dc0fa6f32df941778051db2bd5ffdf3e5",
  "pack_id": "rumi_tool_validation_pack",
  "source_identity": "sha256:c942b61891fdcda50554adfd73b27d94cc14c78a18bec223da8ae0c0879434f8",
  "variants": [
    {
      "architecture": "any",
      "backend": "tobkiri.python-host-v4",
      "execution_domain_profile": "host.extension.default.v1",
      "execution_kind": "host_extension",
      "function_id": "rumi_tool_validation_pack.tool-validation.arguments",
      "implementation_digest": "sha256:620f3c4bcfdc56e28f43dfa236a8582f9f648b9d75e3b0f8c4cc937f7d0e165d",
      "implementation_path": "runtime/validator.py",
      "materialization_mode": "on_demand",
      "operations": [
        {
          "contract_id": "tobkiri.service.tool.arguments.validate.v1",
          "contract_version": "1.0.0",
          "effect_class": "privileged",
          "error_schema": {
            "type": "object"
          },
          "idempotency": "none",
          "input_schema": {
            "additionalProperties": false,
            "properties": {
              "arguments": {
                "title": "検証する値"
              },
              "schema": {
                "title": "検証するスキーマ",
                "type": "object",
                "x-tobkiri-flow-role": "configuration"
              }
            },
            "required": [
              "schema",
              "arguments"
            ],
            "type": "object"
          },
          "operation_id": "rumi_tool_validation_pack.tool-arguments-validate",
          "output_schema": {
            "additionalProperties": false,
            "properties": {
              "arguments": {
                "title": "検証後の値"
              },
              "coerced": {
                "const": false,
                "x-tobkiri-flow-role": "metadata"
              },
              "errors": {
                "items": {
                  "additionalProperties": false,
                  "properties": {
                    "code": {
                      "type": "string"
                    },
                    "message": {
                      "type": "string"
                    },
                    "path": {
                      "type": "string"
                    }
                  },
                  "required": [
                    "path",
                    "code",
                    "message"
                  ],
                  "type": "object"
                },
                "type": "array"
              },
              "valid": {
                "title": "適合",
                "type": "boolean"
              }
            },
            "required": [
              "valid",
              "arguments",
              "errors",
              "coerced"
            ],
            "type": "object"
          },
          "revision_digest": "sha256:2a557f2eed95894d8ebcdb4223265c7f087a88f298290ff31952cede9584c588",
          "timeout_default_ms": 30000,
          "timeout_hard_max_ms": 300000
        }
      ],
      "platform": "any",
      "runtime_abi": "python3.13",
      "variant_id": "rumi_tool_validation_pack.tool-validation.arguments.python"
    }
  ]
}
