{
  "catalog_api_version": "io.tobkiri.executable-catalog.v4",
  "catalog_digest": "sha256:a57cd509ace752fe2d7a444e714ccbeff83720c781ebed3163c6f5cc044af166",
  "pack_id": "rumi_file_patch_pack",
  "source_identity": "sha256:68afe1096a6680584dd9de5024a0ffed6bd522ff900dc78694c42a4b26943c2f",
  "variants": [
    {
      "architecture": "any",
      "backend": "tobkiri.python-host-v4",
      "execution_domain_profile": "host.extension.default.v1",
      "execution_kind": "host_extension",
      "function_id": "rumi_file_patch_pack.file-patch.service",
      "implementation_digest": "sha256:c706fc33ef41284698a398f2f3742c0352f325eaf95acbd7448f0a4cfa68d416",
      "implementation_path": "runtime/patch.py",
      "materialization_mode": "on_demand",
      "operations": [
        {
          "contract_id": "tobkiri.service.file.patch.v1",
          "contract_version": "1.0.0",
          "effect_class": "privileged",
          "error_schema": {
            "type": "object"
          },
          "idempotency": "none",
          "input_schema": {
            "type": "object"
          },
          "operation_id": "rumi_file_patch_pack.file-patch",
          "output_schema": {
            "type": "object"
          },
          "revision_digest": "sha256:ef3d5198377b8ca71ad52b64d5e45213397aebcf522c1ea5473c170446caee63",
          "timeout_default_ms": 30000,
          "timeout_hard_max_ms": 300000
        }
      ],
      "platform": "any",
      "runtime_abi": "python3.13",
      "variant_id": "rumi_file_patch_pack.file-patch.service.python"
    }
  ]
}
