{
  "catalog_api_version": "io.tobkiri.executable-catalog.v4",
  "catalog_digest": "sha256:fc0e7fb2f543959872505ea321bf8fb5eaf86dae019174c7bad4ae757b7e955f",
  "pack_id": "rumi_connector_company_adapter_pack",
  "source_identity": "sha256:5037828d32c4c19f465bf433b7fdfc9ee2d3dafa27d2bc42d07126d0bc35b0d6",
  "variants": [
    {
      "architecture": "any",
      "backend": "tobkiri.python-pack-v4",
      "execution_domain_profile": "sandbox.default.v1",
      "execution_kind": "pack_vm",
      "function_id": "rumi_connector_company_adapter_pack.connector-route.company",
      "implementation_digest": "sha256:57fdce0cee3b5660cc37ccc3df9ad1fc633b96f14c9743371342adfaf987a6e2",
      "implementation_path": "runtime/adapter.py",
      "materialization_mode": "on_demand",
      "operations": [
        {
          "contract_id": "tobkiri.action.connector.route.v1",
          "contract_version": "1.0.0",
          "effect_class": "read",
          "error_schema": {
            "type": "object"
          },
          "idempotency": "none",
          "input_schema": {
            "type": "object"
          },
          "operation_id": "rumi_connector_company_adapter_pack.connector-company-route",
          "output_schema": {
            "type": "object"
          },
          "revision_digest": "sha256:ba5b6299d1bcf1847d0a5f2a3ff10dc1c19182414afd0555df74295f4306a9ec",
          "timeout_default_ms": 30000,
          "timeout_hard_max_ms": 300000
        }
      ],
      "platform": "any",
      "runtime_abi": "python3.13",
      "variant_id": "rumi_connector_company_adapter_pack.connector-route.company.python"
    }
  ]
}
